{
  "id": "diocese-de-irece",
  "nome": {
    "valor": "Diocese de Irecê",
    "fonte": "wikidata",
    "fonte_url": "http://www.wikidata.org/entity/Q655380",
    "verificado_em": "2026-08-18",
    "confianca": "media",
    "metodo": "automatico"
  },
  "tipo": "diocese",
  "tipo_jurisdicao": "territorial",
  "granularidade_territorial": "municipio",
  "regional_cnbb": "nordeste-3",
  "provincia_eclesiastica": {
    "id": "arquidiocese-de-feira-de-santana",
    "papel": "sufraganea"
  },
  "ereta_em": {
    "valor": "1979-01-01",
    "fonte": "wikidata (P571 inception)",
    "fonte_url": "http://www.wikidata.org/entity/Q655380",
    "verificado_em": "2026-08-18",
    "confianca": "media",
    "metodo": "automatico"
  },
  "bispo_atual": {
    "nome": null,
    "oficio": "bispo",
    "valido_de": null,
    "fonte": null,
    "fonte_url": null,
    "verificado_em": null,
    "confianca": "nao_verificado",
    "metodo": "automatico"
  },
  "territorio": {
    "tipo": "municipios_ibge",
    "municipios_ibge": [
      "2901155", "2903003", "2903235", "2905305", "2906204", "2907608",
      "2912400", "2913101", "2914406", "2914604", "2918357", "2918506",
      "2919157", "2919306", "2921708", "2922052", "2923506", "2925600",
      "2929255", "2929909", "2930808", "2932408"
    ],
    "fonte": "wikipedia, cruzado com tools/ibge-municipios.json",
    "fonte_url": "https://pt.wikipedia.org/wiki/Diocese_de_Irecê",
    "verificado_em": "2026-09-18",
    "confianca": "alta",
    "metodo": "manual"
  },
  "crosswalk": {
    "wikidata_qid": "Q655380",
    "gcatholic_id": "irec0",
    "catholic_hierarchy_id": null,
    "cdic_id": null
  }
}
