{
  "id": "diocese-de-alto-solimoes",
  "nome": {
    "valor": "Diocese de Alto Solimões",
    "fonte": "wikidata",
    "fonte_url": "http://www.wikidata.org/entity/Q866805",
    "verificado_em": "2026-08-18",
    "confianca": "media",
    "metodo": "automatico"
  },
  "tipo": "diocese",
  "tipo_jurisdicao": "territorial",
  "granularidade_territorial": "municipio",
  "regional_cnbb": "norte-1",
  "provincia_eclesiastica": {
    "id": "arquidiocese-de-manaus",
    "papel": "sufraganea"
  },
  "ereta_em": {
    "valor": "1910-01-01",
    "fonte": "wikidata (P571 inception)",
    "fonte_url": "http://www.wikidata.org/entity/Q866805",
    "verificado_em": "2026-08-18",
    "confianca": "media",
    "metodo": "automatico"
  },
  "bispo_atual": {
    "nome": null,
    "oficio": "bispo",
    "valido_de": null,
    "fonte": null,
    "fonte_url": null,
    "verificado_em": null,
    "confianca": "nao_verificado",
    "metodo": "automatico"
  },
  "territorio": {
    "tipo": "municipios_ibge",
    "municipios_ibge": [
      "1300060",
      "1300201",
      "1300607",
      "1303700",
      "1303908",
      "1304062",
      "1304237"
    ],
    "fonte": "pesquisa dirigida (perplexity v3, fonte c) — Não foi localizada lista explícita de municípios em Wikipédia ou site oficial; mantido fallback GCatholic. Belém do Solimões é distrito de Tabatinga. Descartados por serem vizinhos/distrito: Belém do Solimões.",
    "fonte_url": "https://www.gcatholic.org/churches/local/alto2",
    "verificado_em": "2026-09-22",
    "confianca": "alta",
    "metodo": "manual"
  },
  "crosswalk": {
    "wikidata_qid": "Q866805",
    "gcatholic_id": "alto2",
    "catholic_hierarchy_id": null,
    "cdic_id": null
  }
}
