{
  "id": "arquidiocese-de-vitoria-da-conquista",
  "nome": {
    "valor": "Arquidiocese de Vitória da Conquista",
    "fonte": "wikidata",
    "fonte_url": "http://www.wikidata.org/entity/Q1365853",
    "verificado_em": "2026-08-18",
    "confianca": "media",
    "metodo": "automatico"
  },
  "tipo": "arquidiocese",
  "tipo_jurisdicao": "territorial",
  "granularidade_territorial": "municipio",
  "regional_cnbb": "nordeste-3",
  "provincia_eclesiastica": {
    "id": "arquidiocese-de-vitoria-da-conquista",
    "papel": "metropolitana"
  },
  "ereta_em": {
    "valor": "1957-01-01",
    "fonte": "wikidata (P571 inception)",
    "fonte_url": "http://www.wikidata.org/entity/Q1365853",
    "verificado_em": "2026-08-18",
    "confianca": "media",
    "metodo": "automatico"
  },
  "bispo_atual": {
    "nome": null,
    "oficio": "arcebispo",
    "valido_de": null,
    "fonte": null,
    "fonte_url": null,
    "verificado_em": null,
    "confianca": "nao_verificado",
    "metodo": "automatico"
  },
  "territorio": {
    "tipo": "municipios_ibge",
    "municipios_ibge": [
      "2901205", "2902906", "2903508", "2903953", "2904803", "2905156",
      "2906709", "2910404", "2912301", "2913507", "2915809", "2916401",
      "2916807", "2919702", "2920007", "2922706", "2925006", "2925105",
      "2926657", "2933307"
    ],
    "fonte": "wikipedia, cruzado com tools/ibge-municipios.json",
    "fonte_url": "https://pt.wikipedia.org/wiki/Arquidiocese_de_Vitória_da_Conquista",
    "verificado_em": "2026-09-18",
    "confianca": "alta",
    "metodo": "manual"
  },
  "crosswalk": {
    "wikidata_qid": "Q1365853",
    "gcatholic_id": "vito2",
    "catholic_hierarchy_id": null,
    "cdic_id": null
  }
}
