{
  "id": "diocese-de-baturite",
  "nome": {
    "valor": "Diocese de Baturité",
    "fonte": "wikidata",
    "fonte_url": "http://www.wikidata.org/entity/Q137655591",
    "verificado_em": "2026-08-18",
    "confianca": "media",
    "metodo": "automatico"
  },
  "tipo": "diocese",
  "tipo_jurisdicao": "territorial",
  "granularidade_territorial": "municipio",
  "regional_cnbb": "nordeste-1",
  "provincia_eclesiastica": {
    "id": "arquidiocese-de-fortaleza",
    "papel": "sufraganea"
  },
  "ereta_em": {
    "valor": "2026-01-01",
    "fonte": "wikidata (P571 inception)",
    "fonte_url": "http://www.wikidata.org/entity/Q137655591",
    "verificado_em": "2026-08-18",
    "confianca": "media",
    "metodo": "automatico"
  },
  "bispo_atual": {
    "nome": null,
    "oficio": "bispo",
    "valido_de": null,
    "fonte": null,
    "fonte_url": null,
    "verificado_em": null,
    "confianca": "nao_verificado",
    "metodo": "automatico"
  },
  "territorio": {
    "tipo": "municipios_ibge",
    "municipios_ibge": [
      "2300150", "2301208", "2301406", "2301950", "2302107", "2302800",
      "2303006", "2305100", "2309102", "2309458", "2309805", "2310100",
      "2310407", "2311603"
    ],
    "fonte": "wikipedia, cruzado com tools/ibge-municipios.json",
    "fonte_url": "https://pt.wikipedia.org/wiki/Diocese_de_Baturité",
    "verificado_em": "2026-09-18",
    "confianca": "alta",
    "metodo": "manual"
  },
  "crosswalk": {
    "wikidata_qid": "Q137655591",
    "gcatholic_id": "batu0",
    "catholic_hierarchy_id": null,
    "cdic_id": null
  }
}
