{
  "id": "diocese-de-parintins",
  "nome": {
    "valor": "Diocese de Parintins",
    "fonte": "wikidata",
    "fonte_url": "http://www.wikidata.org/entity/Q873927",
    "verificado_em": "2026-08-18",
    "confianca": "media",
    "metodo": "automatico"
  },
  "tipo": "diocese",
  "tipo_jurisdicao": "territorial",
  "granularidade_territorial": "municipio",
  "regional_cnbb": "norte-1",
  "provincia_eclesiastica": {
    "id": "arquidiocese-de-manaus",
    "papel": "sufraganea"
  },
  "ereta_em": {
    "valor": "1955-01-01",
    "fonte": "wikidata (P571 inception)",
    "fonte_url": "http://www.wikidata.org/entity/Q873927",
    "verificado_em": "2026-08-18",
    "confianca": "media",
    "metodo": "automatico"
  },
  "bispo_atual": {
    "nome": null,
    "oficio": "bispo",
    "valido_de": null,
    "fonte": null,
    "fonte_url": null,
    "verificado_em": null,
    "confianca": "nao_verificado",
    "metodo": "automatico"
  },
  "territorio": {
    "tipo": "municipios_ibge",
    "municipios_ibge": [
      "1300508",
      "1302900",
      "1303007",
      "1303403"
    ],
    "fonte": "pesquisa dirigida (perplexity v2, fonte a)",
    "fonte_url": "https://pt.wikipedia.org/wiki/Diocese_de_Parintins",
    "verificado_em": "2026-09-22",
    "confianca": "alta",
    "metodo": "manual"
  },
  "crosswalk": {
    "wikidata_qid": "Q873927",
    "gcatholic_id": "pari1",
    "catholic_hierarchy_id": null,
    "cdic_id": null
  }
}
