{
  "id": "diocese-de-serrinha",
  "nome": {
    "valor": "Diocese de Serrinha",
    "fonte": "wikidata",
    "fonte_url": "http://www.wikidata.org/entity/Q876365",
    "verificado_em": "2026-08-18",
    "confianca": "media",
    "metodo": "automatico"
  },
  "tipo": "diocese",
  "tipo_jurisdicao": "territorial",
  "granularidade_territorial": "municipio",
  "regional_cnbb": "nordeste-3",
  "provincia_eclesiastica": {
    "id": "arquidiocese-de-feira-de-santana",
    "papel": "sufraganea"
  },
  "ereta_em": {
    "valor": "2005-01-01",
    "fonte": "wikidata (P571 inception)",
    "fonte_url": "http://www.wikidata.org/entity/Q876365",
    "verificado_em": "2026-08-18",
    "confianca": "media",
    "metodo": "automatico"
  },
  "bispo_atual": {
    "nome": null,
    "oficio": "bispo",
    "valido_de": null,
    "fonte": null,
    "fonte_url": null,
    "verificado_em": null,
    "confianca": "nao_verificado",
    "metodo": "automatico"
  },
  "territorio": {
    "tipo": "municipios_ibge",
    "municipios_ibge": [
      "2902104",
      "2903276",
      "2903607",
      "2906857",
      "2908408",
      "2910701",
      "2911253",
      "2913309",
      "2919108",
      "2922730",
      "2924058",
      "2925907",
      "2926103",
      "2926301",
      "2928000",
      "2928950",
      "2930501",
      "2931509",
      "2931905",
      "2933000"
    ],
    "fonte": "pesquisa dirigida (perplexity v3, fonte a)",
    "fonte_url": "https://it.wikipedia.org/wiki/Diocesi_di_Serrinha",
    "verificado_em": "2026-09-22",
    "confianca": "alta",
    "metodo": "manual"
  },
  "crosswalk": {
    "wikidata_qid": "Q876365",
    "gcatholic_id": "serr0",
    "catholic_hierarchy_id": null,
    "cdic_id": null
  }
}
